{
  "sentence": "— Дмитрий Прокофьич.",
  "tokens": [
    "—",
    "Дмитрий",
    "Прокофьич",
    "."
  ],
  "morphs": [
    {
      "index": 0,
      "token": "—",
      "homonyms": [
        {
          "index": 0,
          "word": "—",
          "lexem": "—",
          "tags": "NID",
          "active": false
        }
      ]
    },
    {
      "index": 1,
      "token": "Дмитрий",
      "homonyms": [
        {
          "index": 0,
          "word": "дмитрий",
          "lexem": "дмитрий",
          "tags": "S ЕД МУЖ ИМ ОД",
          "active": false
        },
        {
          "index": 1,
          "word": "дмитрий",
          "lexem": "дмитрия",
          "tags": "S МН ЖЕН РОД ОД",
          "active": false
        },
        {
          "index": 2,
          "word": "дмитрий",
          "lexem": "дмитрия",
          "tags": "S МН ЖЕН ВИН ОД",
          "active": false
        }
      ]
    },
    {
      "index": 2,
      "token": "Прокофьич",
      "homonyms": [
        {
          "index": 0,
          "word": "прокофьич",
          "lexem": "прокофьич",
          "tags": "S ЕД МУЖ ИМ ОД",
          "active": false
        },
        {
          "index": 1,
          "word": "прокофьич",
          "lexem": "прокофьич",
          "tags": "A ЕД МУЖ ИМ",
          "active": false
        },
        {
          "index": 2,
          "word": "прокофьич",
          "lexem": "прокофьич",
          "tags": "A ЕД МУЖ РОД",
          "active": false
        },
        {
          "index": 3,
          "word": "прокофьич",
          "lexem": "прокофьич",
          "tags": "A ЕД МУЖ ДАТ",
          "active": false
        },
        {
          "index": 4,
          "word": "прокофьич",
          "lexem": "прокофьич",
          "tags": "A ЕД МУЖ ВИН",
          "active": false
        },
        {
          "index": 5,
          "word": "прокофьич",
          "lexem": "прокофьич",
          "tags": "A ЕД МУЖ ТВОР",
          "active": false
        },
        {
          "index": 6,
          "word": "прокофьич",
          "lexem": "прокофьич",
          "tags": "A ЕД МУЖ ПР",
          "active": false
        },
        {
          "index": 7,
          "word": "прокофьич",
          "lexem": "прокофьич",
          "tags": "A ЕД ЖЕН ИМ",
          "active": false
        },
        {
          "index": 8,
          "word": "прокофьич",
          "lexem": "прокофьич",
          "tags": "A ЕД ЖЕН РОД",
          "active": false
        },
        {
          "index": 9,
          "word": "прокофьич",
          "lexem": "прокофьич",
          "tags": "A ЕД ЖЕН ДАТ",
          "active": false
        },
        {
          "index": 10,
          "word": "прокофьич",
          "lexem": "прокофьич",
          "tags": "A ЕД ЖЕН ВИН",
          "active": false
        },
        {
          "index": 11,
          "word": "прокофьич",
          "lexem": "прокофьич",
          "tags": "A ЕД ЖЕН ТВОР",
          "active": false
        },
        {
          "index": 12,
          "word": "прокофьич",
          "lexem": "прокофьич",
          "tags": "A ЕД ЖЕН ПР",
          "active": false
        },
        {
          "index": 13,
          "word": "прокофьич",
          "lexem": "прокофьич",
          "tags": "A ЕД СР ИМ",
          "active": false
        },
        {
          "index": 14,
          "word": "прокофьич",
          "lexem": "прокофьич",
          "tags": "A ЕД СР РОД",
          "active": false
        },
        {
          "index": 15,
          "word": "прокофьич",
          "lexem": "прокофьич",
          "tags": "A ЕД СР ДАТ",
          "active": false
        },
        {
          "index": 16,
          "word": "прокофьич",
          "lexem": "прокофьич",
          "tags": "A ЕД СР ВИН",
          "active": false
        },
        {
          "index": 17,
          "word": "прокофьич",
          "lexem": "прокофьич",
          "tags": "A ЕД СР ТВОР",
          "active": false
        },
        {
          "index": 18,
          "word": "прокофьич",
          "lexem": "прокофьич",
          "tags": "A ЕД СР ПР",
          "active": false
        },
        {
          "index": 19,
          "word": "прокофьич",
          "lexem": "прокофьич",
          "tags": "A МН ИМ",
          "active": false
        },
        {
          "index": 20,
          "word": "прокофьич",
          "lexem": "прокофьич",
          "tags": "A МН РОД",
          "active": false
        },
        {
          "index": 21,
          "word": "прокофьич",
          "lexem": "прокофьич",
          "tags": "A МН ДАТ",
          "active": false
        },
        {
          "index": 22,
          "word": "прокофьич",
          "lexem": "прокофьич",
          "tags": "A МН ВИН",
          "active": false
        },
        {
          "index": 23,
          "word": "прокофьич",
          "lexem": "прокофьич",
          "tags": "A МН ТВОР",
          "active": false
        },
        {
          "index": 24,
          "word": "прокофьич",
          "lexem": "прокофьич",
          "tags": "A МН ПР",
          "active": false
        }
      ]
    },
    {
      "index": 3,
      "token": ".",
      "homonyms": [
        {
          "index": 0,
          "word": ".",
          "lexem": ".",
          "tags": "NID",
          "active": false
        }
      ]
    }
  ],
  "synts": []
}