{
  "sentence": "— Я уверена, что она достойная была девушка, — коротко заметила Авдотья Романовна.",
  "tokens": [
    "—",
    "Я",
    "уверена",
    ",",
    "что",
    "она",
    "достойная",
    "была",
    "девушка",
    ",",
    "—",
    "коротко",
    "заметила",
    "Авдотья",
    "Романовна",
    "."
  ],
  "morphs": [
    {
      "index": 0,
      "token": "—",
      "homonyms": [
        {
          "index": 0,
          "word": "—",
          "lexem": "—",
          "tags": "NID",
          "active": false
        }
      ]
    },
    {
      "index": 1,
      "token": "Я",
      "homonyms": [
        {
          "index": 0,
          "word": "я",
          "lexem": "я",
          "tags": "S ЕД ИМ",
          "active": false
        },
        {
          "index": 1,
          "word": "я",
          "lexem": "я",
          "tags": "S ЕД МУЖ ИМ ОД",
          "active": false
        },
        {
          "index": 2,
          "word": "я",
          "lexem": "я",
          "tags": "S ЕД МУЖ РОД ОД",
          "active": false
        },
        {
          "index": 3,
          "word": "я",
          "lexem": "я",
          "tags": "S ЕД МУЖ ДАТ ОД",
          "active": false
        },
        {
          "index": 4,
          "word": "я",
          "lexem": "я",
          "tags": "S ЕД МУЖ ВИН ОД",
          "active": false
        },
        {
          "index": 5,
          "word": "я",
          "lexem": "я",
          "tags": "S ЕД МУЖ ТВОР ОД",
          "active": false
        },
        {
          "index": 6,
          "word": "я",
          "lexem": "я",
          "tags": "S ЕД МУЖ ПР ОД",
          "active": false
        },
        {
          "index": 7,
          "word": "я",
          "lexem": "я",
          "tags": "S ЕД ЖЕН ИМ ОД",
          "active": false
        },
        {
          "index": 8,
          "word": "я",
          "lexem": "я",
          "tags": "S ЕД ЖЕН РОД ОД",
          "active": false
        },
        {
          "index": 9,
          "word": "я",
          "lexem": "я",
          "tags": "S ЕД ЖЕН ДАТ ОД",
          "active": false
        },
        {
          "index": 10,
          "word": "я",
          "lexem": "я",
          "tags": "S ЕД ЖЕН ВИН ОД",
          "active": false
        },
        {
          "index": 11,
          "word": "я",
          "lexem": "я",
          "tags": "S ЕД ЖЕН ТВОР ОД",
          "active": false
        },
        {
          "index": 12,
          "word": "я",
          "lexem": "я",
          "tags": "S ЕД ЖЕН ПР ОД",
          "active": false
        },
        {
          "index": 13,
          "word": "я",
          "lexem": "я",
          "tags": "S ЕД МУЖ ИМ ОД",
          "active": false
        },
        {
          "index": 14,
          "word": "я",
          "lexem": "я",
          "tags": "S ЕД МУЖ РОД ОД",
          "active": false
        },
        {
          "index": 15,
          "word": "я",
          "lexem": "я",
          "tags": "S ЕД МУЖ ДАТ ОД",
          "active": false
        },
        {
          "index": 16,
          "word": "я",
          "lexem": "я",
          "tags": "S ЕД МУЖ ВИН ОД",
          "active": false
        },
        {
          "index": 17,
          "word": "я",
          "lexem": "я",
          "tags": "S ЕД МУЖ ТВОР ОД",
          "active": false
        },
        {
          "index": 18,
          "word": "я",
          "lexem": "я",
          "tags": "S ЕД МУЖ ПР ОД",
          "active": false
        },
        {
          "index": 19,
          "word": "я",
          "lexem": "я",
          "tags": "S ЕД ЖЕН ИМ ОД",
          "active": false
        },
        {
          "index": 20,
          "word": "я",
          "lexem": "я",
          "tags": "S ЕД ЖЕН РОД ОД",
          "active": false
        },
        {
          "index": 21,
          "word": "я",
          "lexem": "я",
          "tags": "S ЕД ЖЕН ДАТ ОД",
          "active": false
        },
        {
          "index": 22,
          "word": "я",
          "lexem": "я",
          "tags": "S ЕД ЖЕН ВИН ОД",
          "active": false
        },
        {
          "index": 23,
          "word": "я",
          "lexem": "я",
          "tags": "S ЕД ЖЕН ТВОР ОД",
          "active": false
        },
        {
          "index": 24,
          "word": "я",
          "lexem": "я",
          "tags": "S ЕД ЖЕН ПР ОД",
          "active": false
        }
      ]
    },
    {
      "index": 2,
      "token": "уверена",
      "homonyms": [
        {
          "index": 0,
          "word": "уверена",
          "lexem": "уверить",
          "tags": "V ПРИЧ КР ЕД ЖЕН",
          "active": true
        }
      ]
    },
    {
      "index": 3,
      "token": ",",
      "homonyms": [
        {
          "index": 0,
          "word": ",",
          "lexem": ",",
          "tags": "NID",
          "active": false
        }
      ]
    },
    {
      "index": 4,
      "token": "что",
      "homonyms": [
        {
          "index": 0,
          "word": "что",
          "lexem": "что",
          "tags": "CONJ",
          "active": false
        },
        {
          "index": 1,
          "word": "что",
          "lexem": "что",
          "tags": "PART",
          "active": false
        },
        {
          "index": 2,
          "word": "что",
          "lexem": "что",
          "tags": "S ЕД СР ВИН",
          "active": true
        },
        {
          "index": 3,
          "word": "что",
          "lexem": "что",
          "tags": "S ЕД СР ИМ",
          "active": false
        },
        {
          "index": 4,
          "word": "что",
          "lexem": "что",
          "tags": "ADV",
          "active": false
        }
      ]
    },
    {
      "index": 5,
      "token": "она",
      "homonyms": [
        {
          "index": 0,
          "word": "она",
          "lexem": "она",
          "tags": "S ЕД ЖЕН ИМ",
          "active": true
        }
      ]
    },
    {
      "index": 6,
      "token": "достойная",
      "homonyms": [
        {
          "index": 0,
          "word": "достойная",
          "lexem": "достойный",
          "tags": "A ЕД ЖЕН ИМ",
          "active": true
        }
      ]
    },
    {
      "index": 7,
      "token": "была",
      "homonyms": [
        {
          "index": 0,
          "word": "была",
          "lexem": "быть",
          "tags": "V ЕД НЕСОВ ПРОШ ИЗЪЯВ",
          "active": true
        }
      ]
    },
    {
      "index": 8,
      "token": "девушка",
      "homonyms": [
        {
          "index": 0,
          "word": "девушка",
          "lexem": "девушка",
          "tags": "S ЕД ЖЕН ИМ ОД",
          "active": true
        }
      ]
    },
    {
      "index": 9,
      "token": ",",
      "homonyms": [
        {
          "index": 0,
          "word": ",",
          "lexem": ",",
          "tags": "NID",
          "active": false
        }
      ]
    },
    {
      "index": 10,
      "token": "—",
      "homonyms": [
        {
          "index": 0,
          "word": "—",
          "lexem": "—",
          "tags": "NID",
          "active": false
        }
      ]
    },
    {
      "index": 11,
      "token": "коротко",
      "homonyms": [
        {
          "index": 0,
          "word": "коротко",
          "lexem": "коротко",
          "tags": "ADV",
          "active": false
        },
        {
          "index": 1,
          "word": "коротко",
          "lexem": "короткий",
          "tags": "A КР ЕД СР",
          "active": false
        }
      ]
    },
    {
      "index": 12,
      "token": "заметила",
      "homonyms": [
        {
          "index": 0,
          "word": "заметила",
          "lexem": "заметить",
          "tags": "V ЕД СОВ ПРОШ ИЗЪЯВ",
          "active": false
        }
      ]
    },
    {
      "index": 13,
      "token": "Авдотья",
      "homonyms": [
        {
          "index": 0,
          "word": "авдотья",
          "lexem": "авдотья",
          "tags": "S ЕД ЖЕН ИМ ОД",
          "active": true
        }
      ]
    },
    {
      "index": 14,
      "token": "Романовна",
      "homonyms": [
        {
          "index": 0,
          "word": "романовна",
          "lexem": "романович",
          "tags": "S ЕД ЖЕН ИМ ОД",
          "active": true
        }
      ]
    },
    {
      "index": 15,
      "token": ".",
      "homonyms": [
        {
          "index": 0,
          "word": ".",
          "lexem": ".",
          "tags": "NID",
          "active": false
        }
      ]
    }
  ],
  "synts": [
    {
      "dep_type": "опред",
      "head": "она",
      "dependent": "достойная",
      "head_i": 5,
      "head_homonym_i": 0,
      "dependent_i": 6,
      "dependent_homonym_i": 0
    },
    {
      "dep_type": "аппоз",
      "head": "авдотья",
      "dependent": "романовна",
      "head_i": 13,
      "head_homonym_i": 0,
      "dependent_i": 14,
      "dependent_homonym_i": 0
    },
    {
      "dep_type": "предик",
      "head": "была",
      "dependent": "она",
      "head_i": 7,
      "head_homonym_i": 0,
      "dependent_i": 5,
      "dependent_homonym_i": 0
    },
    {
      "dep_type": "предик",
      "head": "была",
      "dependent": "девушка",
      "head_i": 7,
      "head_homonym_i": 0,
      "dependent_i": 8,
      "dependent_homonym_i": 0
    },
    {
      "dep_type": "предик",
      "head": "была",
      "dependent": "авдотья",
      "head_i": 7,
      "head_homonym_i": 0,
      "dependent_i": 13,
      "dependent_homonym_i": 0
    },
    {
      "dep_type": "1-компл",
      "head": "уверена",
      "dependent": "что",
      "head_i": 2,
      "head_homonym_i": 0,
      "dependent_i": 4,
      "dependent_homonym_i": 2
    }
  ]
}