{
  "sentence": "Ничего, пойду.",
  "tokens": [
    "Ничего",
    ",",
    "пойду",
    "."
  ],
  "morphs": [
    {
      "index": 0,
      "token": "Ничего",
      "homonyms": [
        {
          "index": 0,
          "word": "ничего",
          "lexem": "ничего",
          "tags": "ADV",
          "active": false
        },
        {
          "index": 1,
          "word": "ничего",
          "lexem": "ничего",
          "tags": "PART",
          "active": false
        },
        {
          "index": 2,
          "word": "ничего",
          "lexem": "ничто",
          "tags": "S ЕД СР РОД",
          "active": false
        },
        {
          "index": 3,
          "word": "ничего",
          "lexem": "ничего",
          "tags": "S ЕД СР ИМ",
          "active": true
        }
      ]
    },
    {
      "index": 1,
      "token": ",",
      "homonyms": [
        {
          "index": 0,
          "word": ",",
          "lexem": ",",
          "tags": "NID",
          "active": false
        }
      ]
    },
    {
      "index": 2,
      "token": "пойду",
      "homonyms": [
        {
          "index": 0,
          "word": "пойду",
          "lexem": "пойти",
          "tags": "V ЕД СОВ НЕПРОШ ИЗЪЯВ 1-Л",
          "active": true
        }
      ]
    },
    {
      "index": 3,
      "token": ".",
      "homonyms": [
        {
          "index": 0,
          "word": ".",
          "lexem": ".",
          "tags": "NID",
          "active": false
        }
      ]
    }
  ],
  "synts": [
    {
      "dep_type": "предик",
      "head": "пойду",
      "dependent": "ничего",
      "head_i": 2,
      "head_homonym_i": 0,
      "dependent_i": 0,
      "dependent_homonym_i": 3
    }
  ]
}