{
  "sentence": "А впрочем, и я сам вчера...",
  "tokens": [
    "А",
    "впрочем",
    ",",
    "и",
    "я",
    "сам",
    "вчера",
    "..."
  ],
  "morphs": [
    {
      "index": 0,
      "token": "А",
      "homonyms": [
        {
          "index": 0,
          "word": "а",
          "lexem": "а",
          "tags": "CONJ",
          "active": false
        },
        {
          "index": 1,
          "word": "а",
          "lexem": "а",
          "tags": "INTJ",
          "active": false
        },
        {
          "index": 2,
          "word": "а",
          "lexem": "а",
          "tags": "PART",
          "active": false
        },
        {
          "index": 3,
          "word": "а",
          "lexem": "а",
          "tags": "S ЕД МУЖ ИМ ОД",
          "active": false
        },
        {
          "index": 4,
          "word": "а",
          "lexem": "а",
          "tags": "S ЕД МУЖ РОД ОД",
          "active": false
        },
        {
          "index": 5,
          "word": "а",
          "lexem": "а",
          "tags": "S ЕД МУЖ ДАТ ОД",
          "active": false
        },
        {
          "index": 6,
          "word": "а",
          "lexem": "а",
          "tags": "S ЕД МУЖ ВИН ОД",
          "active": false
        },
        {
          "index": 7,
          "word": "а",
          "lexem": "а",
          "tags": "S ЕД МУЖ ТВОР ОД",
          "active": false
        },
        {
          "index": 8,
          "word": "а",
          "lexem": "а",
          "tags": "S ЕД МУЖ ПР ОД",
          "active": false
        },
        {
          "index": 9,
          "word": "а",
          "lexem": "а",
          "tags": "S ЕД ЖЕН ИМ ОД",
          "active": false
        },
        {
          "index": 10,
          "word": "а",
          "lexem": "а",
          "tags": "S ЕД ЖЕН РОД ОД",
          "active": false
        },
        {
          "index": 11,
          "word": "а",
          "lexem": "а",
          "tags": "S ЕД ЖЕН ДАТ ОД",
          "active": false
        },
        {
          "index": 12,
          "word": "а",
          "lexem": "а",
          "tags": "S ЕД ЖЕН ВИН ОД",
          "active": false
        },
        {
          "index": 13,
          "word": "а",
          "lexem": "а",
          "tags": "S ЕД ЖЕН ТВОР ОД",
          "active": false
        },
        {
          "index": 14,
          "word": "а",
          "lexem": "а",
          "tags": "S ЕД ЖЕН ПР ОД",
          "active": false
        },
        {
          "index": 15,
          "word": "а",
          "lexem": "а",
          "tags": "S ЕД МУЖ ИМ ОД",
          "active": false
        },
        {
          "index": 16,
          "word": "а",
          "lexem": "а",
          "tags": "S ЕД МУЖ РОД ОД",
          "active": false
        },
        {
          "index": 17,
          "word": "а",
          "lexem": "а",
          "tags": "S ЕД МУЖ ДАТ ОД",
          "active": false
        },
        {
          "index": 18,
          "word": "а",
          "lexem": "а",
          "tags": "S ЕД МУЖ ВИН ОД",
          "active": false
        },
        {
          "index": 19,
          "word": "а",
          "lexem": "а",
          "tags": "S ЕД МУЖ ТВОР ОД",
          "active": false
        },
        {
          "index": 20,
          "word": "а",
          "lexem": "а",
          "tags": "S ЕД МУЖ ПР ОД",
          "active": false
        },
        {
          "index": 21,
          "word": "а",
          "lexem": "а",
          "tags": "S ЕД ЖЕН ИМ ОД",
          "active": false
        },
        {
          "index": 22,
          "word": "а",
          "lexem": "а",
          "tags": "S ЕД ЖЕН РОД ОД",
          "active": false
        },
        {
          "index": 23,
          "word": "а",
          "lexem": "а",
          "tags": "S ЕД ЖЕН ДАТ ОД",
          "active": false
        },
        {
          "index": 24,
          "word": "а",
          "lexem": "а",
          "tags": "S ЕД ЖЕН ВИН ОД",
          "active": false
        },
        {
          "index": 25,
          "word": "а",
          "lexem": "а",
          "tags": "S ЕД ЖЕН ТВОР ОД",
          "active": false
        },
        {
          "index": 26,
          "word": "а",
          "lexem": "а",
          "tags": "S ЕД ЖЕН ПР ОД",
          "active": false
        }
      ]
    },
    {
      "index": 1,
      "token": "впрочем",
      "homonyms": [
        {
          "index": 0,
          "word": "впрочем",
          "lexem": "впрочем",
          "tags": "CONJ",
          "active": false
        }
      ]
    },
    {
      "index": 2,
      "token": ",",
      "homonyms": [
        {
          "index": 0,
          "word": ",",
          "lexem": ",",
          "tags": "NID",
          "active": false
        }
      ]
    },
    {
      "index": 3,
      "token": "и",
      "homonyms": [
        {
          "index": 0,
          "word": "и",
          "lexem": "и",
          "tags": "CONJ",
          "active": true
        },
        {
          "index": 1,
          "word": "и",
          "lexem": "и",
          "tags": "PART",
          "active": false
        },
        {
          "index": 2,
          "word": "и",
          "lexem": "и",
          "tags": "INTJ",
          "active": false
        },
        {
          "index": 3,
          "word": "и",
          "lexem": "и",
          "tags": "S ЕД МУЖ ИМ ОД",
          "active": false
        },
        {
          "index": 4,
          "word": "и",
          "lexem": "и",
          "tags": "S ЕД МУЖ РОД ОД",
          "active": false
        },
        {
          "index": 5,
          "word": "и",
          "lexem": "и",
          "tags": "S ЕД МУЖ ДАТ ОД",
          "active": false
        },
        {
          "index": 6,
          "word": "и",
          "lexem": "и",
          "tags": "S ЕД МУЖ ВИН ОД",
          "active": false
        },
        {
          "index": 7,
          "word": "и",
          "lexem": "и",
          "tags": "S ЕД МУЖ ТВОР ОД",
          "active": false
        },
        {
          "index": 8,
          "word": "и",
          "lexem": "и",
          "tags": "S ЕД МУЖ ПР ОД",
          "active": false
        },
        {
          "index": 9,
          "word": "и",
          "lexem": "и",
          "tags": "S МН МУЖ ИМ ОД",
          "active": false
        },
        {
          "index": 10,
          "word": "и",
          "lexem": "и",
          "tags": "S МН МУЖ РОД ОД",
          "active": false
        },
        {
          "index": 11,
          "word": "и",
          "lexem": "и",
          "tags": "S МН МУЖ ДАТ ОД",
          "active": false
        },
        {
          "index": 12,
          "word": "и",
          "lexem": "и",
          "tags": "S МН МУЖ ВИН ОД",
          "active": false
        },
        {
          "index": 13,
          "word": "и",
          "lexem": "и",
          "tags": "S МН МУЖ ТВОР ОД",
          "active": false
        },
        {
          "index": 14,
          "word": "и",
          "lexem": "и",
          "tags": "S МН МУЖ ПР ОД",
          "active": false
        }
      ]
    },
    {
      "index": 4,
      "token": "я",
      "homonyms": [
        {
          "index": 0,
          "word": "я",
          "lexem": "я",
          "tags": "S ЕД ИМ",
          "active": true
        }
      ]
    },
    {
      "index": 5,
      "token": "сам",
      "homonyms": [
        {
          "index": 0,
          "word": "сам",
          "lexem": "сам",
          "tags": "A ЕД МУЖ ИМ",
          "active": true
        },
        {
          "index": 1,
          "word": "сам",
          "lexem": "сам",
          "tags": "A ЕД МУЖ ВИН",
          "active": true
        }
      ]
    },
    {
      "index": 6,
      "token": "вчера",
      "homonyms": [
        {
          "index": 0,
          "word": "вчера",
          "lexem": "вчера",
          "tags": "ADV",
          "active": true
        }
      ]
    },
    {
      "index": 7,
      "token": "...",
      "homonyms": [
        {
          "index": 0,
          "word": "...",
          "lexem": "...",
          "tags": "NID",
          "active": false
        }
      ]
    }
  ],
  "synts": [
    {
      "dep_type": "соч-союзн",
      "head": "и",
      "dependent": "я",
      "head_i": 3,
      "head_homonym_i": 0,
      "dependent_i": 4,
      "dependent_homonym_i": 0
    },
    {
      "dep_type": "соч-союзн",
      "head": "и",
      "dependent": "сам",
      "head_i": 3,
      "head_homonym_i": 0,
      "dependent_i": 5,
      "dependent_homonym_i": 0
    },
    {
      "dep_type": "соч-союзн",
      "head": "и",
      "dependent": "сам",
      "head_i": 3,
      "head_homonym_i": 0,
      "dependent_i": 5,
      "dependent_homonym_i": 1
    },
    {
      "dep_type": "обст",
      "head": "я",
      "dependent": "вчера",
      "head_i": 4,
      "head_homonym_i": 0,
      "dependent_i": 6,
      "dependent_homonym_i": 0
    }
  ]
}