{
  "sentence": "Она будет мне в зад, пыль-то...",
  "tokens": [
    "Она",
    "будет",
    "мне",
    "в",
    "зад",
    ",",
    "пыль-то",
    "..."
  ],
  "morphs": [
    {
      "index": 0,
      "token": "Она",
      "homonyms": [
        {
          "index": 0,
          "word": "она",
          "lexem": "она",
          "tags": "S ЕД ЖЕН ИМ",
          "active": true
        }
      ]
    },
    {
      "index": 1,
      "token": "будет",
      "homonyms": [
        {
          "index": 0,
          "word": "будет",
          "lexem": "быть",
          "tags": "V ЕД НЕСОВ НЕПРОШ ИЗЪЯВ 3-Л",
          "active": true
        }
      ]
    },
    {
      "index": 2,
      "token": "мне",
      "homonyms": [
        {
          "index": 0,
          "word": "мне",
          "lexem": "я",
          "tags": "S ЕД ДАТ",
          "active": true
        },
        {
          "index": 1,
          "word": "мне",
          "lexem": "я",
          "tags": "S ЕД ПР",
          "active": false
        }
      ]
    },
    {
      "index": 3,
      "token": "в",
      "homonyms": [
        {
          "index": 0,
          "word": "в",
          "lexem": "в",
          "tags": "PR",
          "active": true
        },
        {
          "index": 1,
          "word": "в",
          "lexem": "в",
          "tags": "S ЕД МУЖ РОД НЕОД",
          "active": false
        },
        {
          "index": 2,
          "word": "в",
          "lexem": "в",
          "tags": "S ЕД МУЖ ПР НЕОД",
          "active": false
        },
        {
          "index": 3,
          "word": "в",
          "lexem": "в",
          "tags": "S ЕД МУЖ ИМ НЕОД",
          "active": false
        },
        {
          "index": 4,
          "word": "в",
          "lexem": "в",
          "tags": "S ЕД МУЖ ДАТ НЕОД",
          "active": false
        },
        {
          "index": 5,
          "word": "в",
          "lexem": "в",
          "tags": "S ЕД МУЖ ВИН НЕОД",
          "active": false
        },
        {
          "index": 6,
          "word": "в",
          "lexem": "в",
          "tags": "S ЕД МУЖ ТВОР НЕОД",
          "active": false
        },
        {
          "index": 7,
          "word": "в",
          "lexem": "в",
          "tags": "S МН МУЖ ИМ НЕОД",
          "active": false
        },
        {
          "index": 8,
          "word": "в",
          "lexem": "в",
          "tags": "S МН МУЖ РОД НЕОД",
          "active": false
        },
        {
          "index": 9,
          "word": "в",
          "lexem": "в",
          "tags": "S МН МУЖ ДАТ НЕОД",
          "active": false
        },
        {
          "index": 10,
          "word": "в",
          "lexem": "в",
          "tags": "S МН МУЖ ВИН НЕОД",
          "active": false
        },
        {
          "index": 11,
          "word": "в",
          "lexem": "в",
          "tags": "S МН МУЖ ТВОР НЕОД",
          "active": false
        },
        {
          "index": 12,
          "word": "в",
          "lexem": "в",
          "tags": "S МН МУЖ ПР НЕОД",
          "active": false
        }
      ]
    },
    {
      "index": 4,
      "token": "зад",
      "homonyms": [
        {
          "index": 0,
          "word": "зад",
          "lexem": "зад",
          "tags": "S ЕД МУЖ ВИН НЕОД",
          "active": true
        },
        {
          "index": 1,
          "word": "зад",
          "lexem": "зад",
          "tags": "S ЕД МУЖ ИМ НЕОД",
          "active": true
        }
      ]
    },
    {
      "index": 5,
      "token": ",",
      "homonyms": [
        {
          "index": 0,
          "word": ",",
          "lexem": ",",
          "tags": "NID",
          "active": false
        }
      ]
    },
    {
      "index": 6,
      "token": "пыль-то",
      "homonyms": [
        {
          "index": 0,
          "word": "пыль-то",
          "lexem": "пыль-то",
          "tags": "S ЕД ЖЕН ИМ НЕОД",
          "active": true
        },
        {
          "index": 1,
          "word": "пыль-то",
          "lexem": "пыль-то",
          "tags": "S ЕД ЖЕН ВИН НЕОД",
          "active": true
        }
      ]
    },
    {
      "index": 7,
      "token": "...",
      "homonyms": [
        {
          "index": 0,
          "word": "...",
          "lexem": "...",
          "tags": "NID",
          "active": false
        }
      ]
    }
  ],
  "synts": [
    {
      "dep_type": "предл",
      "head": "в",
      "dependent": "зад",
      "head_i": 3,
      "head_homonym_i": 0,
      "dependent_i": 4,
      "dependent_homonym_i": 0
    },
    {
      "dep_type": "предл",
      "head": "в",
      "dependent": "зад",
      "head_i": 3,
      "head_homonym_i": 0,
      "dependent_i": 4,
      "dependent_homonym_i": 1
    },
    {
      "dep_type": "об-аппоз",
      "head": "зад",
      "dependent": "пыль-то",
      "head_i": 4,
      "head_homonym_i": 0,
      "dependent_i": 6,
      "dependent_homonym_i": 1
    },
    {
      "dep_type": "об-аппоз",
      "head": "зад",
      "dependent": "пыль-то",
      "head_i": 4,
      "head_homonym_i": 1,
      "dependent_i": 6,
      "dependent_homonym_i": 0
    },
    {
      "dep_type": "предик",
      "head": "будет",
      "dependent": "она",
      "head_i": 1,
      "head_homonym_i": 0,
      "dependent_i": 0,
      "dependent_homonym_i": 0
    },
    {
      "dep_type": "1-компл",
      "head": "будет",
      "dependent": "мне",
      "head_i": 1,
      "head_homonym_i": 0,
      "dependent_i": 2,
      "dependent_homonym_i": 0
    },
    {
      "dep_type": "1-компл",
      "head": "будет",
      "dependent": "в",
      "head_i": 1,
      "head_homonym_i": 0,
      "dependent_i": 3,
      "dependent_homonym_i": 0
    },
    {
      "dep_type": "сочин",
      "head": "зад",
      "dependent": "пыль-то",
      "head_i": 4,
      "head_homonym_i": 0,
      "dependent_i": 6,
      "dependent_homonym_i": 1
    },
    {
      "dep_type": "сочин",
      "head": "зад",
      "dependent": "пыль-то",
      "head_i": 4,
      "head_homonym_i": 1,
      "dependent_i": 6,
      "dependent_homonym_i": 0
    },
    {
      "dep_type": "обст",
      "head": "будет",
      "dependent": "в",
      "head_i": 1,
      "head_homonym_i": 0,
      "dependent_i": 3,
      "dependent_homonym_i": 0
    }
  ]
}