{
  "sentence": "Я не удостоился лицезреть...",
  "tokens": [
    "Я",
    "не",
    "удостоился",
    "лицезреть",
    "..."
  ],
  "morphs": [
    {
      "index": 0,
      "token": "Я",
      "homonyms": [
        {
          "index": 0,
          "word": "я",
          "lexem": "я",
          "tags": "S ЕД ИМ",
          "active": true
        },
        {
          "index": 1,
          "word": "я",
          "lexem": "я",
          "tags": "S ЕД МУЖ ИМ ОД",
          "active": false
        },
        {
          "index": 2,
          "word": "я",
          "lexem": "я",
          "tags": "S ЕД МУЖ РОД ОД",
          "active": false
        },
        {
          "index": 3,
          "word": "я",
          "lexem": "я",
          "tags": "S ЕД МУЖ ДАТ ОД",
          "active": false
        },
        {
          "index": 4,
          "word": "я",
          "lexem": "я",
          "tags": "S ЕД МУЖ ВИН ОД",
          "active": false
        },
        {
          "index": 5,
          "word": "я",
          "lexem": "я",
          "tags": "S ЕД МУЖ ТВОР ОД",
          "active": false
        },
        {
          "index": 6,
          "word": "я",
          "lexem": "я",
          "tags": "S ЕД МУЖ ПР ОД",
          "active": false
        },
        {
          "index": 7,
          "word": "я",
          "lexem": "я",
          "tags": "S ЕД ЖЕН ИМ ОД",
          "active": false
        },
        {
          "index": 8,
          "word": "я",
          "lexem": "я",
          "tags": "S ЕД ЖЕН РОД ОД",
          "active": false
        },
        {
          "index": 9,
          "word": "я",
          "lexem": "я",
          "tags": "S ЕД ЖЕН ДАТ ОД",
          "active": false
        },
        {
          "index": 10,
          "word": "я",
          "lexem": "я",
          "tags": "S ЕД ЖЕН ВИН ОД",
          "active": false
        },
        {
          "index": 11,
          "word": "я",
          "lexem": "я",
          "tags": "S ЕД ЖЕН ТВОР ОД",
          "active": false
        },
        {
          "index": 12,
          "word": "я",
          "lexem": "я",
          "tags": "S ЕД ЖЕН ПР ОД",
          "active": false
        },
        {
          "index": 13,
          "word": "я",
          "lexem": "я",
          "tags": "S ЕД МУЖ ИМ ОД",
          "active": false
        },
        {
          "index": 14,
          "word": "я",
          "lexem": "я",
          "tags": "S ЕД МУЖ РОД ОД",
          "active": false
        },
        {
          "index": 15,
          "word": "я",
          "lexem": "я",
          "tags": "S ЕД МУЖ ДАТ ОД",
          "active": false
        },
        {
          "index": 16,
          "word": "я",
          "lexem": "я",
          "tags": "S ЕД МУЖ ВИН ОД",
          "active": false
        },
        {
          "index": 17,
          "word": "я",
          "lexem": "я",
          "tags": "S ЕД МУЖ ТВОР ОД",
          "active": false
        },
        {
          "index": 18,
          "word": "я",
          "lexem": "я",
          "tags": "S ЕД МУЖ ПР ОД",
          "active": false
        },
        {
          "index": 19,
          "word": "я",
          "lexem": "я",
          "tags": "S ЕД ЖЕН ИМ ОД",
          "active": false
        },
        {
          "index": 20,
          "word": "я",
          "lexem": "я",
          "tags": "S ЕД ЖЕН РОД ОД",
          "active": false
        },
        {
          "index": 21,
          "word": "я",
          "lexem": "я",
          "tags": "S ЕД ЖЕН ДАТ ОД",
          "active": false
        },
        {
          "index": 22,
          "word": "я",
          "lexem": "я",
          "tags": "S ЕД ЖЕН ВИН ОД",
          "active": false
        },
        {
          "index": 23,
          "word": "я",
          "lexem": "я",
          "tags": "S ЕД ЖЕН ТВОР ОД",
          "active": false
        },
        {
          "index": 24,
          "word": "я",
          "lexem": "я",
          "tags": "S ЕД ЖЕН ПР ОД",
          "active": false
        }
      ]
    },
    {
      "index": 1,
      "token": "не",
      "homonyms": [
        {
          "index": 0,
          "word": "не",
          "lexem": "не",
          "tags": "PART",
          "active": true
        }
      ]
    },
    {
      "index": 2,
      "token": "удостоился",
      "homonyms": [
        {
          "index": 0,
          "word": "удостоился",
          "lexem": "удостоиться",
          "tags": "V ЕД СОВ ПРОШ ИЗЪЯВ",
          "active": true
        }
      ]
    },
    {
      "index": 3,
      "token": "лицезреть",
      "homonyms": [
        {
          "index": 0,
          "word": "лицезреть",
          "lexem": "лицезреть",
          "tags": "V ИНФ НЕСОВ",
          "active": true
        }
      ]
    },
    {
      "index": 4,
      "token": "...",
      "homonyms": [
        {
          "index": 0,
          "word": "...",
          "lexem": "...",
          "tags": "NID",
          "active": false
        }
      ]
    }
  ],
  "synts": [
    {
      "dep_type": "огранич",
      "head": "удостоился",
      "dependent": "не",
      "head_i": 2,
      "head_homonym_i": 0,
      "dependent_i": 1,
      "dependent_homonym_i": 0
    },
    {
      "dep_type": "предик",
      "head": "удостоился",
      "dependent": "я",
      "head_i": 2,
      "head_homonym_i": 0,
      "dependent_i": 0,
      "dependent_homonym_i": 0
    },
    {
      "dep_type": "обст",
      "head": "удостоился",
      "dependent": "лицезреть",
      "head_i": 2,
      "head_homonym_i": 0,
      "dependent_i": 3,
      "dependent_homonym_i": 0
    }
  ]
}