{
  "sentence": "Приданого тоже никакого, да он на приданое и не стал бы рассчитывать...",
  "tokens": [
    "Приданого",
    "тоже",
    "никакого",
    ",",
    "да",
    "он",
    "на",
    "приданое",
    "и",
    "не",
    "стал",
    "бы",
    "рассчитывать",
    "..."
  ],
  "morphs": [
    {
      "index": 0,
      "token": "Приданого",
      "homonyms": [
        {
          "index": 0,
          "word": "приданого",
          "lexem": "приданое",
          "tags": "S ЕД СР РОД НЕОД",
          "active": true
        }
      ]
    },
    {
      "index": 1,
      "token": "тоже",
      "homonyms": [
        {
          "index": 0,
          "word": "тоже",
          "lexem": "тоже",
          "tags": "PART",
          "active": false
        }
      ]
    },
    {
      "index": 2,
      "token": "никакого",
      "homonyms": [
        {
          "index": 0,
          "word": "никакого",
          "lexem": "никакой",
          "tags": "A ЕД СР РОД",
          "active": true
        },
        {
          "index": 1,
          "word": "никакого",
          "lexem": "никакой",
          "tags": "A ЕД МУЖ РОД",
          "active": false
        },
        {
          "index": 2,
          "word": "никакого",
          "lexem": "никакой",
          "tags": "A ЕД МУЖ ВИН",
          "active": false
        }
      ]
    },
    {
      "index": 3,
      "token": ",",
      "homonyms": [
        {
          "index": 0,
          "word": ",",
          "lexem": ",",
          "tags": "NID",
          "active": false
        }
      ]
    },
    {
      "index": 4,
      "token": "да",
      "homonyms": [
        {
          "index": 0,
          "word": "да",
          "lexem": "да",
          "tags": "PART",
          "active": false
        },
        {
          "index": 1,
          "word": "да",
          "lexem": "да",
          "tags": "CONJ",
          "active": false
        },
        {
          "index": 2,
          "word": "да",
          "lexem": "да",
          "tags": "INTJ",
          "active": false
        }
      ]
    },
    {
      "index": 5,
      "token": "он",
      "homonyms": [
        {
          "index": 0,
          "word": "он",
          "lexem": "он",
          "tags": "S ЕД МУЖ ИМ",
          "active": true
        }
      ]
    },
    {
      "index": 6,
      "token": "на",
      "homonyms": [
        {
          "index": 0,
          "word": "на",
          "lexem": "на",
          "tags": "PR",
          "active": true
        },
        {
          "index": 1,
          "word": "на",
          "lexem": "на",
          "tags": "PART",
          "active": false
        },
        {
          "index": 2,
          "word": "на",
          "lexem": "на",
          "tags": "INTJ",
          "active": false
        }
      ]
    },
    {
      "index": 7,
      "token": "приданое",
      "homonyms": [
        {
          "index": 0,
          "word": "приданое",
          "lexem": "приданое",
          "tags": "S ЕД СР ИМ НЕОД",
          "active": false
        },
        {
          "index": 1,
          "word": "приданое",
          "lexem": "приданое",
          "tags": "S ЕД СР ВИН НЕОД",
          "active": true
        }
      ]
    },
    {
      "index": 8,
      "token": "и",
      "homonyms": [
        {
          "index": 0,
          "word": "и",
          "lexem": "и",
          "tags": "CONJ",
          "active": true
        },
        {
          "index": 1,
          "word": "и",
          "lexem": "и",
          "tags": "PART",
          "active": false
        },
        {
          "index": 2,
          "word": "и",
          "lexem": "и",
          "tags": "INTJ",
          "active": false
        },
        {
          "index": 3,
          "word": "и",
          "lexem": "и",
          "tags": "S ЕД МУЖ ИМ ОД",
          "active": false
        },
        {
          "index": 4,
          "word": "и",
          "lexem": "и",
          "tags": "S ЕД МУЖ РОД ОД",
          "active": false
        },
        {
          "index": 5,
          "word": "и",
          "lexem": "и",
          "tags": "S ЕД МУЖ ДАТ ОД",
          "active": false
        },
        {
          "index": 6,
          "word": "и",
          "lexem": "и",
          "tags": "S ЕД МУЖ ВИН ОД",
          "active": false
        },
        {
          "index": 7,
          "word": "и",
          "lexem": "и",
          "tags": "S ЕД МУЖ ТВОР ОД",
          "active": false
        },
        {
          "index": 8,
          "word": "и",
          "lexem": "и",
          "tags": "S ЕД МУЖ ПР ОД",
          "active": false
        },
        {
          "index": 9,
          "word": "и",
          "lexem": "и",
          "tags": "S МН МУЖ ИМ ОД",
          "active": false
        },
        {
          "index": 10,
          "word": "и",
          "lexem": "и",
          "tags": "S МН МУЖ РОД ОД",
          "active": false
        },
        {
          "index": 11,
          "word": "и",
          "lexem": "и",
          "tags": "S МН МУЖ ДАТ ОД",
          "active": false
        },
        {
          "index": 12,
          "word": "и",
          "lexem": "и",
          "tags": "S МН МУЖ ВИН ОД",
          "active": false
        },
        {
          "index": 13,
          "word": "и",
          "lexem": "и",
          "tags": "S МН МУЖ ТВОР ОД",
          "active": false
        },
        {
          "index": 14,
          "word": "и",
          "lexem": "и",
          "tags": "S МН МУЖ ПР ОД",
          "active": false
        }
      ]
    },
    {
      "index": 9,
      "token": "не",
      "homonyms": [
        {
          "index": 0,
          "word": "не",
          "lexem": "не",
          "tags": "PART",
          "active": true
        }
      ]
    },
    {
      "index": 10,
      "token": "стал",
      "homonyms": [
        {
          "index": 0,
          "word": "стал",
          "lexem": "стать",
          "tags": "V ЕД СОВ ПРОШ ИЗЪЯВ",
          "active": true
        }
      ]
    },
    {
      "index": 11,
      "token": "бы",
      "homonyms": [
        {
          "index": 0,
          "word": "бы",
          "lexem": "бы",
          "tags": "PART",
          "active": true
        }
      ]
    },
    {
      "index": 12,
      "token": "рассчитывать",
      "homonyms": [
        {
          "index": 0,
          "word": "рассчитывать",
          "lexem": "рассчитывать",
          "tags": "V ИНФ НЕСОВ",
          "active": true
        },
        {
          "index": 1,
          "word": "рассчитывать",
          "lexem": "рассчитывать",
          "tags": "V ИНФ НЕСОВ",
          "active": true
        }
      ]
    },
    {
      "index": 13,
      "token": "...",
      "homonyms": [
        {
          "index": 0,
          "word": "...",
          "lexem": "...",
          "tags": "NID",
          "active": false
        }
      ]
    }
  ],
  "synts": [
    {
      "dep_type": "опред",
      "head": "приданого",
      "dependent": "никакого",
      "head_i": 0,
      "head_homonym_i": 0,
      "dependent_i": 2,
      "dependent_homonym_i": 0
    },
    {
      "dep_type": "предл",
      "head": "на",
      "dependent": "приданое",
      "head_i": 6,
      "head_homonym_i": 0,
      "dependent_i": 7,
      "dependent_homonym_i": 1
    },
    {
      "dep_type": "огранич",
      "head": "стал",
      "dependent": "не",
      "head_i": 10,
      "head_homonym_i": 0,
      "dependent_i": 9,
      "dependent_homonym_i": 0
    },
    {
      "dep_type": "аналит",
      "head": "стал",
      "dependent": "бы",
      "head_i": 10,
      "head_homonym_i": 0,
      "dependent_i": 11,
      "dependent_homonym_i": 0
    },
    {
      "dep_type": "предик",
      "head": "стал",
      "dependent": "он",
      "head_i": 10,
      "head_homonym_i": 0,
      "dependent_i": 5,
      "dependent_homonym_i": 0
    },
    {
      "dep_type": "несобст-агент",
      "head": "стал",
      "dependent": "приданого",
      "head_i": 10,
      "head_homonym_i": 0,
      "dependent_i": 0,
      "dependent_homonym_i": 0
    },
    {
      "dep_type": "1-компл",
      "head": "стал",
      "dependent": "на",
      "head_i": 10,
      "head_homonym_i": 0,
      "dependent_i": 6,
      "dependent_homonym_i": 0
    },
    {
      "dep_type": "соч-союзн",
      "head": "и",
      "dependent": "стал",
      "head_i": 8,
      "head_homonym_i": 0,
      "dependent_i": 10,
      "dependent_homonym_i": 0
    },
    {
      "dep_type": "сочин",
      "head": "приданое",
      "dependent": "и",
      "head_i": 7,
      "head_homonym_i": 1,
      "dependent_i": 8,
      "dependent_homonym_i": 0
    },
    {
      "dep_type": "обст",
      "head": "стал",
      "dependent": "на",
      "head_i": 10,
      "head_homonym_i": 0,
      "dependent_i": 6,
      "dependent_homonym_i": 0
    },
    {
      "dep_type": "обст",
      "head": "стал",
      "dependent": "рассчитывать",
      "head_i": 10,
      "head_homonym_i": 0,
      "dependent_i": 12,
      "dependent_homonym_i": 0
    },
    {
      "dep_type": "обст",
      "head": "стал",
      "dependent": "рассчитывать",
      "head_i": 10,
      "head_homonym_i": 0,
      "dependent_i": 12,
      "dependent_homonym_i": 1
    }
  ]
}