{
  "sentence": "Разумихин донес ему, что тот спит, как сурок.",
  "tokens": [
    "Разумихин",
    "донес",
    "ему",
    ",",
    "что",
    "тот",
    "спит",
    ",",
    "как",
    "сурок",
    "."
  ],
  "morphs": [
    {
      "index": 0,
      "token": "Разумихин",
      "homonyms": [
        {
          "index": 0,
          "word": "разумихин",
          "lexem": "разумихин",
          "tags": "S ЕД МУЖ ИМ ОД",
          "active": true
        }
      ]
    },
    {
      "index": 1,
      "token": "донес",
      "homonyms": [
        {
          "index": 0,
          "word": "донёс",
          "lexem": "донести",
          "tags": "V ЕД СОВ ПРОШ ИЗЪЯВ",
          "active": true
        }
      ]
    },
    {
      "index": 2,
      "token": "ему",
      "homonyms": [
        {
          "index": 0,
          "word": "ему",
          "lexem": "он",
          "tags": "S ЕД МУЖ ДАТ",
          "active": true
        },
        {
          "index": 1,
          "word": "ему",
          "lexem": "оно",
          "tags": "S ЕД СР ДАТ",
          "active": false
        }
      ]
    },
    {
      "index": 3,
      "token": ",",
      "homonyms": [
        {
          "index": 0,
          "word": ",",
          "lexem": ",",
          "tags": "NID",
          "active": false
        }
      ]
    },
    {
      "index": 4,
      "token": "что",
      "homonyms": [
        {
          "index": 0,
          "word": "что",
          "lexem": "что",
          "tags": "CONJ",
          "active": false
        },
        {
          "index": 1,
          "word": "что",
          "lexem": "что",
          "tags": "PART",
          "active": false
        },
        {
          "index": 2,
          "word": "что",
          "lexem": "что",
          "tags": "S ЕД СР ВИН",
          "active": false
        },
        {
          "index": 3,
          "word": "что",
          "lexem": "что",
          "tags": "S ЕД СР ИМ",
          "active": true
        },
        {
          "index": 4,
          "word": "что",
          "lexem": "что",
          "tags": "ADV",
          "active": false
        }
      ]
    },
    {
      "index": 5,
      "token": "тот",
      "homonyms": [
        {
          "index": 0,
          "word": "тот",
          "lexem": "тот",
          "tags": "A ЕД МУЖ ИМ",
          "active": true
        },
        {
          "index": 1,
          "word": "тот",
          "lexem": "тот",
          "tags": "A ЕД МУЖ ВИН",
          "active": true
        }
      ]
    },
    {
      "index": 6,
      "token": "спит",
      "homonyms": [
        {
          "index": 0,
          "word": "спит",
          "lexem": "спать",
          "tags": "V ЕД НЕСОВ НЕПРОШ ИЗЪЯВ 3-Л",
          "active": true
        },
        {
          "index": 1,
          "word": "спит",
          "lexem": "спить",
          "tags": "V ПРИЧ КР ЕД МУЖ",
          "active": true
        }
      ]
    },
    {
      "index": 7,
      "token": ",",
      "homonyms": [
        {
          "index": 0,
          "word": ",",
          "lexem": ",",
          "tags": "NID",
          "active": false
        }
      ]
    },
    {
      "index": 8,
      "token": "как",
      "homonyms": [
        {
          "index": 0,
          "word": "как",
          "lexem": "как",
          "tags": "CONJ",
          "active": false
        },
        {
          "index": 1,
          "word": "как",
          "lexem": "как",
          "tags": "ADV",
          "active": false
        },
        {
          "index": 2,
          "word": "как",
          "lexem": "как",
          "tags": "PART",
          "active": false
        }
      ]
    },
    {
      "index": 9,
      "token": "сурок",
      "homonyms": [
        {
          "index": 0,
          "word": "сурок",
          "lexem": "сурок",
          "tags": "S ЕД МУЖ ИМ ОД",
          "active": true
        }
      ]
    },
    {
      "index": 10,
      "token": ".",
      "homonyms": [
        {
          "index": 0,
          "word": ".",
          "lexem": ".",
          "tags": "NID",
          "active": false
        }
      ]
    }
  ],
  "synts": [
    {
      "dep_type": "предик",
      "head": "донёс",
      "dependent": "разумихин",
      "head_i": 1,
      "head_homonym_i": 0,
      "dependent_i": 0,
      "dependent_homonym_i": 0
    },
    {
      "dep_type": "предик",
      "head": "спит",
      "dependent": "что",
      "head_i": 6,
      "head_homonym_i": 0,
      "dependent_i": 4,
      "dependent_homonym_i": 3
    },
    {
      "dep_type": "предик",
      "head": "спит",
      "dependent": "сурок",
      "head_i": 6,
      "head_homonym_i": 0,
      "dependent_i": 9,
      "dependent_homonym_i": 0
    },
    {
      "dep_type": "предик",
      "head": "спит",
      "dependent": "сурок",
      "head_i": 6,
      "head_homonym_i": 1,
      "dependent_i": 9,
      "dependent_homonym_i": 0
    },
    {
      "dep_type": "1-компл",
      "head": "донёс",
      "dependent": "ему",
      "head_i": 1,
      "head_homonym_i": 0,
      "dependent_i": 2,
      "dependent_homonym_i": 0
    },
    {
      "dep_type": "1-компл",
      "head": "донёс",
      "dependent": "тот",
      "head_i": 1,
      "head_homonym_i": 0,
      "dependent_i": 5,
      "dependent_homonym_i": 1
    },
    {
      "dep_type": "1-компл",
      "head": "спит",
      "dependent": "тот",
      "head_i": 6,
      "head_homonym_i": 0,
      "dependent_i": 5,
      "dependent_homonym_i": 0
    },
    {
      "dep_type": "1-компл",
      "head": "спит",
      "dependent": "тот",
      "head_i": 6,
      "head_homonym_i": 0,
      "dependent_i": 5,
      "dependent_homonym_i": 1
    },
    {
      "dep_type": "1-компл",
      "head": "спит",
      "dependent": "тот",
      "head_i": 6,
      "head_homonym_i": 1,
      "dependent_i": 5,
      "dependent_homonym_i": 0
    },
    {
      "dep_type": "1-компл",
      "head": "спит",
      "dependent": "тот",
      "head_i": 6,
      "head_homonym_i": 1,
      "dependent_i": 5,
      "dependent_homonym_i": 1
    },
    {
      "dep_type": "релят",
      "head": "ему",
      "dependent": "спит",
      "head_i": 2,
      "head_homonym_i": 0,
      "dependent_i": 6,
      "dependent_homonym_i": 0
    },
    {
      "dep_type": "релят",
      "head": "ему",
      "dependent": "спит",
      "head_i": 2,
      "head_homonym_i": 0,
      "dependent_i": 6,
      "dependent_homonym_i": 1
    }
  ]
}