{
  "sentence": "А там, во дворе, уже запрягают лошадей.",
  "tokens": [
    "А",
    "там",
    ",",
    "во",
    "дворе",
    ",",
    "уже",
    "запрягают",
    "лошадей",
    "."
  ],
  "morphs": [
    {
      "index": 0,
      "token": "А",
      "homonyms": [
        {
          "index": 0,
          "word": "а",
          "lexem": "а",
          "tags": "CONJ",
          "active": true
        },
        {
          "index": 1,
          "word": "а",
          "lexem": "а",
          "tags": "INTJ",
          "active": false
        },
        {
          "index": 2,
          "word": "а",
          "lexem": "а",
          "tags": "PART",
          "active": false
        },
        {
          "index": 3,
          "word": "а",
          "lexem": "а",
          "tags": "S ЕД МУЖ ИМ ОД",
          "active": false
        },
        {
          "index": 4,
          "word": "а",
          "lexem": "а",
          "tags": "S ЕД МУЖ РОД ОД",
          "active": false
        },
        {
          "index": 5,
          "word": "а",
          "lexem": "а",
          "tags": "S ЕД МУЖ ДАТ ОД",
          "active": false
        },
        {
          "index": 6,
          "word": "а",
          "lexem": "а",
          "tags": "S ЕД МУЖ ВИН ОД",
          "active": false
        },
        {
          "index": 7,
          "word": "а",
          "lexem": "а",
          "tags": "S ЕД МУЖ ТВОР ОД",
          "active": false
        },
        {
          "index": 8,
          "word": "а",
          "lexem": "а",
          "tags": "S ЕД МУЖ ПР ОД",
          "active": false
        },
        {
          "index": 9,
          "word": "а",
          "lexem": "а",
          "tags": "S ЕД ЖЕН ИМ ОД",
          "active": false
        },
        {
          "index": 10,
          "word": "а",
          "lexem": "а",
          "tags": "S ЕД ЖЕН РОД ОД",
          "active": false
        },
        {
          "index": 11,
          "word": "а",
          "lexem": "а",
          "tags": "S ЕД ЖЕН ДАТ ОД",
          "active": false
        },
        {
          "index": 12,
          "word": "а",
          "lexem": "а",
          "tags": "S ЕД ЖЕН ВИН ОД",
          "active": false
        },
        {
          "index": 13,
          "word": "а",
          "lexem": "а",
          "tags": "S ЕД ЖЕН ТВОР ОД",
          "active": false
        },
        {
          "index": 14,
          "word": "а",
          "lexem": "а",
          "tags": "S ЕД ЖЕН ПР ОД",
          "active": false
        },
        {
          "index": 15,
          "word": "а",
          "lexem": "а",
          "tags": "S ЕД МУЖ ИМ ОД",
          "active": false
        },
        {
          "index": 16,
          "word": "а",
          "lexem": "а",
          "tags": "S ЕД МУЖ РОД ОД",
          "active": false
        },
        {
          "index": 17,
          "word": "а",
          "lexem": "а",
          "tags": "S ЕД МУЖ ДАТ ОД",
          "active": false
        },
        {
          "index": 18,
          "word": "а",
          "lexem": "а",
          "tags": "S ЕД МУЖ ВИН ОД",
          "active": false
        },
        {
          "index": 19,
          "word": "а",
          "lexem": "а",
          "tags": "S ЕД МУЖ ТВОР ОД",
          "active": false
        },
        {
          "index": 20,
          "word": "а",
          "lexem": "а",
          "tags": "S ЕД МУЖ ПР ОД",
          "active": false
        },
        {
          "index": 21,
          "word": "а",
          "lexem": "а",
          "tags": "S ЕД ЖЕН ИМ ОД",
          "active": false
        },
        {
          "index": 22,
          "word": "а",
          "lexem": "а",
          "tags": "S ЕД ЖЕН РОД ОД",
          "active": false
        },
        {
          "index": 23,
          "word": "а",
          "lexem": "а",
          "tags": "S ЕД ЖЕН ДАТ ОД",
          "active": false
        },
        {
          "index": 24,
          "word": "а",
          "lexem": "а",
          "tags": "S ЕД ЖЕН ВИН ОД",
          "active": false
        },
        {
          "index": 25,
          "word": "а",
          "lexem": "а",
          "tags": "S ЕД ЖЕН ТВОР ОД",
          "active": false
        },
        {
          "index": 26,
          "word": "а",
          "lexem": "а",
          "tags": "S ЕД ЖЕН ПР ОД",
          "active": false
        }
      ]
    },
    {
      "index": 1,
      "token": "там",
      "homonyms": [
        {
          "index": 0,
          "word": "там",
          "lexem": "там",
          "tags": "ADV",
          "active": false
        },
        {
          "index": 1,
          "word": "там",
          "lexem": "там",
          "tags": "PART",
          "active": false
        }
      ]
    },
    {
      "index": 2,
      "token": ",",
      "homonyms": [
        {
          "index": 0,
          "word": ",",
          "lexem": ",",
          "tags": "NID",
          "active": false
        }
      ]
    },
    {
      "index": 3,
      "token": "во",
      "homonyms": [
        {
          "index": 0,
          "word": "во",
          "lexem": "в",
          "tags": "PR",
          "active": true
        }
      ]
    },
    {
      "index": 4,
      "token": "дворе",
      "homonyms": [
        {
          "index": 0,
          "word": "дворе",
          "lexem": "двор",
          "tags": "S ЕД МУЖ ПР НЕОД",
          "active": true
        }
      ]
    },
    {
      "index": 5,
      "token": ",",
      "homonyms": [
        {
          "index": 0,
          "word": ",",
          "lexem": ",",
          "tags": "NID",
          "active": false
        }
      ]
    },
    {
      "index": 6,
      "token": "уже",
      "homonyms": [
        {
          "index": 0,
          "word": "уже",
          "lexem": "уже",
          "tags": "ADV",
          "active": true
        },
        {
          "index": 1,
          "word": "уже",
          "lexem": "уже",
          "tags": "PART",
          "active": false
        },
        {
          "index": 2,
          "word": "уже",
          "lexem": "уж",
          "tags": "S ЕД МУЖ ПР ОД",
          "active": true
        },
        {
          "index": 3,
          "word": "уже",
          "lexem": "узкий",
          "tags": "A СРАВ",
          "active": true
        }
      ]
    },
    {
      "index": 7,
      "token": "запрягают",
      "homonyms": [
        {
          "index": 0,
          "word": "запрягают",
          "lexem": "запрягать",
          "tags": "V МН НЕСОВ НЕПРОШ ИЗЪЯВ 3-Л",
          "active": true
        }
      ]
    },
    {
      "index": 8,
      "token": "лошадей",
      "homonyms": [
        {
          "index": 0,
          "word": "лошадей",
          "lexem": "лошадь",
          "tags": "S МН ЖЕН РОД ОД",
          "active": true
        },
        {
          "index": 1,
          "word": "лошадей",
          "lexem": "лошадь",
          "tags": "S МН ЖЕН ВИН ОД",
          "active": true
        }
      ]
    },
    {
      "index": 9,
      "token": ".",
      "homonyms": [
        {
          "index": 0,
          "word": ".",
          "lexem": ".",
          "tags": "NID",
          "active": false
        }
      ]
    }
  ],
  "synts": [
    {
      "dep_type": "предл",
      "head": "во",
      "dependent": "дворе",
      "head_i": 3,
      "head_homonym_i": 0,
      "dependent_i": 4,
      "dependent_homonym_i": 0
    },
    {
      "dep_type": "об-аппоз",
      "head": "дворе",
      "dependent": "уже",
      "head_i": 4,
      "head_homonym_i": 0,
      "dependent_i": 6,
      "dependent_homonym_i": 2
    },
    {
      "dep_type": "1-компл",
      "head": "запрягают",
      "dependent": "во",
      "head_i": 7,
      "head_homonym_i": 0,
      "dependent_i": 3,
      "dependent_homonym_i": 0
    },
    {
      "dep_type": "1-компл",
      "head": "запрягают",
      "dependent": "лошадей",
      "head_i": 7,
      "head_homonym_i": 0,
      "dependent_i": 8,
      "dependent_homonym_i": 1
    },
    {
      "dep_type": "соч-союзн",
      "head": "а",
      "dependent": "уже",
      "head_i": 0,
      "head_homonym_i": 0,
      "dependent_i": 6,
      "dependent_homonym_i": 3
    },
    {
      "dep_type": "соч-союзн",
      "head": "а",
      "dependent": "дворе",
      "head_i": 0,
      "head_homonym_i": 0,
      "dependent_i": 4,
      "dependent_homonym_i": 0
    },
    {
      "dep_type": "соч-союзн",
      "head": "а",
      "dependent": "уже",
      "head_i": 0,
      "head_homonym_i": 0,
      "dependent_i": 6,
      "dependent_homonym_i": 2
    },
    {
      "dep_type": "соч-союзн",
      "head": "а",
      "dependent": "лошадей",
      "head_i": 0,
      "head_homonym_i": 0,
      "dependent_i": 8,
      "dependent_homonym_i": 0
    },
    {
      "dep_type": "соч-союзн",
      "head": "а",
      "dependent": "лошадей",
      "head_i": 0,
      "head_homonym_i": 0,
      "dependent_i": 8,
      "dependent_homonym_i": 1
    },
    {
      "dep_type": "обст",
      "head": "запрягают",
      "dependent": "уже",
      "head_i": 7,
      "head_homonym_i": 0,
      "dependent_i": 6,
      "dependent_homonym_i": 0
    }
  ]
}